,in domain,ood,text,domain,dataset,partition
89,imdb,snli,A white man in the shower has fashioned his hair into a mohawk hairstyle using soap suds. A man wears a hat while sitting on the sofa.,ood,snli,msp
90,imdb,snli,Two cyclist a man and a woman enjoy a leisurely bike ride on the cobblestone path. The two cyclists are outdoors.,ood,snli,msp
91,imdb,snli,An older South American woman is knitting colorful hand warmers and enjoying herself. A tall human knitting,ood,snli,msp
92,imdb,snli,"These two poodles, one black and one brown, are playing. The dogs are playing.",ood,snli,msp
93,imdb,snli,"About your terrible movie copying Beethoven. As a professional musician it's my duty to watch every movie made about any composer and Beethoven is one of my favorites. When Hungarians and Americans meet, it's a terrible combination of empty over the top emotions combined with the worst taste possible. You proved it in your terrible b-movie. The only thing that carries the movie is the music. Of course you didn't bother to look further than the good but in my taste contrived performances of the Tackacs quartet, but OK I have to admit that the performances at least have quality as contrast to the movie you've made. It starts of with the dying DEAF Beethoven who perfectly understands Anna who is merely whispering. Beethoven's hearing during the movie get's better by the minute, but that must be because of some vague divine thing. Then there is the quite impossible semi-pornographic ""eyes wide shut"" double-conducting scene which is totally over the top with the luscious Anna and the crying nephew in the end (who also cries in the deleted scenes with constant red eyes, my GOD what a performance). And as culmination the rip-off from Amadeus, with Beethoven dictating music to Anna not in notes but in total nonsense, which she understands perfectly but no-one else in your audience even trained professional musicians will understand. Of course your reaction will be that negative response is a response at least, but I can assure you that Beethoven himself is turning in his grave because of your worthless creation and with reason. This so called homage is blasphemy and I am so sorry to have rented one of the worst movies ever made even though it's about my favorite subject. Ed Harris and others, you cannot comprehend the greatness of Beethoven in your wildest dreams and certainly not after a couple of lessons in conducting and violin playing. That's the trouble with you Americans: you think you can grasp everything even when it takes a lifetime of hard work. Yeah we can do it anyway! Remember that a good product comes with hard labor, talent, devotion and professionalism. All these you creators of Copying Beethoven lack. See you in kindergarten.",id,imdb,pps
94,imdb,snli,"Screenwriters Peter Viertel, Joan Harrison, and (of all people) Dorothy Parker enable director Alfred Hitchcock to expound on what may have been his favorite movie theme: innocent man, wrongly fingered for crime, takes it on the lam. Hitchcock, who some credit with originating the story, engineers a great deal of suspense in plot about a warehouse worker blamed for the explosion which killed his best friend; he sets out on journey to find the real culprit. Plenty of excitement on a grand-scale, with usually-colorless actors (Priscilla Lane, Norman Lloyd, Alan Baxter) doing surprisingly fine work. Even eternally-smug Robert Cummings gets into the proper spirit! *** from ****",id,imdb,pps
95,imdb,snli,"This movie was a total yawnfest that took forever to get going, but never really did. It was simply boring to watch, so much in fact I could just never really get into it. This movie is not a horror movie by an stretch of the imagination, the cover of the videotape made it out to be one. Instead it is a thriller type movie with a few elements of horror thrown in as to make the movie more interesting. Of course, it does not help this movie at all. Mostly all I remember is that this movie was kind of like a movie from the 1970's called ""The Deep"". Bunch of looking for treasure, rival groups that sort of thing. There are supernatural twists in it too, but to tell you the truth I was so bored when watching this movie that I kind of zoned out so I can not really tell you what the supernatural elements were. I kind of remember footprints on the bottom of the sea so maybe it was some sort of walking dead, or that may be me thinking of Lucio Fulcio's ""Zombie"" movie instead as that one was a horror movie that was set in a tropical island and as outlandish as that one was it was a lot more entertaining than this movie. That day we learned a valuable lesson, never rent a movie based on its cover art.",id,imdb,pps
96,imdb,snli,"In a up and down career with all sorts of movies, this is Altman's one try at science fiction, and it clearly shows that it's not his forte.<br /><br />The film is practically incomprehensible. It seems a disastrous combination of experimental theater pretentiousness and a major studio trying to jump on the post-Star Wars bandwagon (not that this film is at all modelled after that one, but you can imagine that the studio signed on hoping for a much different Paul Newman sci-fi film). The story is nonexistent, the characters remain strangers to us all the way through.<br /><br />Altman has packs of dogs feeding on dead bodies throughout the movie, obviously straining to make some sort of POINT. But since the movie is so poorly thought out, starting with the lack of plot on up, it really isn't about anything at all.<br /><br />The production designed is confused, the photography is undone by the blurs on the edges, and the score is terrible. However, ""Quintet"" does have one redeeming feature. Not only is the movie clearly filmed out in the snow and ice, but the interiors are kept cold as well. You see the actors' breath in every scene. You really FEEL the cold.",id,imdb,pps
97,imdb,snli,"A beautiful, sensitive film that brings home the futility and cruelty of wars no matter what the so-called reasons. The performance of Cage and Cruz were quite impressive, but it is to the older Greek characters that go the highest praises. Irene Papas is as gorgeous as ever! Though some scenes seems a little long at times, this film will be a heavy Oscar contender.",id,imdb,pps
98,imdb,snli,"I absolutely love the first three movies, they were great! I once caught Part 5 on VHS 10 years ago, and I was disappointed. But perhaps that was because I never saw the fourth one, because they were shot back-to-back. but after finally viewing a copy today, I have to say it was no way better than number 5. My expectations weren't high to begin with, but this is cheap direct-to-video stuff, not even a horror movie, it's PG-13. The acting was not convincing, the story was rather dumb without any excitement and there were not many effects. But the main problem is that there were no kills or any gore (the annoying kid who gets killed in his car was supposed to be the highlight, but come on..)<br /><br />Surprisingly, both Parts 4 and 5 were directed by Sequel-director Jeff Burr who gave us the excellent Stepfather II and Leatherface: Texas Chainsaw Massacre III. I liked Puppet Master: The Legacy, even if it was nothing else than a tribute with the best scenes from all movies.<br /><br />Overall, Puppet Master is very much like the Hellraiser Series: A great trilogy but forget the rest..",id,imdb,pps
99,imdb,snli,"This DVD is missing its calling as a Heineken coaster.... This is a great example of why no one should ever go see a sequel with a different director/writer than the original. Two hours of this turkey left me begging for Exorcist 2 reruns. <br /><br />NO legitimate laughs. NOT ONE decent scare. The script was just a mess and I felt bad for the actors who had to perform it (they must have had sick relatives at home or monster coke habits or something).<br /><br />The original was a makeup effects landmark. So naturally, the producers of the sequel thought it would be a great idea to to scrap makeup FX and do CG werewolves instead. These CG werewolves had me laughing a lot harder than any of the ""comedy"". It was just a total miss. If ya want a night's entertainment, go rent the original again. Or go take a film class and make your own horror film. You're bound to do better than these fools did.",id,imdb,pps
100,imdb,snli,"Boogie Nights is one of the best films to come out of the 90's and I'd go so far as to say it should be in the IMDb top 250. I can actually understand why many would dislike it, due to the subject matter. I personally feel however as many do, judging from the aclaim this film's received by viewers and critics that it's topnotch film making.<br /><br />The direction and acting in this film surpass good and reach the level of brilliance.There is not one scene in this movie that isn't amazing. The individual characters reach out and touch you. Given that this is a movie about the porn industry, one wouldn't imagine the sex scenes could be handled with such sensitivity but they are. The direction is among the best I've ever seen-and I've seen a lot of films.<br /><br />The film isn't about one particular personal individual's story, it's about many.It's a character study about people who have many layers to them and who maybe in an industry most would find alien but who still dream the same dreams and have both bad and good to them. Boogie Nights draws you into their story from the beginning, and though the film is long(I believe almost 3 hours) you honestly don't even notice. And when it ends you kind of don't want it to....<br /><br />I'm not easy to impress, meaning there aren't many movies I'd give a 10 of 10 rating to but this is one. Beyond the multiple character study, is the use of music in the film. I have never, in all my years of seeing movies seen music tell a story as well as in this movie.There was such flawlessness to it, you know it's not something your gonna see everyday.<br /><br />Burt reynold's performance was perhaps the best I've ever seen him do, and Mark Wahlberg is incredible(I'm astounded there are still people saying he doesn't act well. I don't know how anyone viewing this could possibly think that)but the person who really surprised me was Heather Grahem(Rollergirl) who is absolutely fantastic in her role, in particular the one memorable scene with Burt Reynolds in the Limo, towards the end.<br /><br />Again, I'll echo other IMDb reviewers in saying this movie is not for everybody. But I still think this was topnotch.10 of 10.",id,imdb,pps
101,imdb,snli,"The young John Garfield turned in a fine performance in the 1939 ""They Made Me a Criminal."" Celebrating a ring victory in a jammed locker room, boxer Johnnie Bradfield emotes about his love of mom, rejection of booze and clean living style to fans, including cops, who eat it up. Later in the evening he's plowed and tussling with his bimbo gal while his manager, in on the con, shares the evening. And the whiskey.<br /><br />A problem develops when another couple arrives. The guy is a newspaper reporter and he says he'll expose Bradfield's phony life on the front page. The manager kills the reporter and he and the floozy depart. The murder discovered, cops, later, are on the lookout for the now somnolent boxer whose car is driven by the manager with his new girlfriend-Johnny's now instant ex. A police chase ends with a fiery car crash. Manager and girl are dead and unrecognizable.<br /><br />Johnny discovers that he's supposed to be a killer. But he's also presumed dead. Seeking advice from a lawyer, he entrusts the counselor with the key to a bank deposit box holding his sole savings, $10,000. The lawyer later gives Johnny $250 and tells him that the balance is his fee for giving him professional advice: get out of town, fast, and go far away. (I would never charge a client more than $5,000 for such pithy, succinct and wise direction.) <br /><br />Johnny, now a freight train hopping hobo, winds up conveniently passing out at an Arizona date ranch where he's nursed back to health by beautiful Goldie West, Ann Sheridan, a fine actress whose career was in the ascendancy. Taking Jack Dorney as his moniker, the pugilist loses some of his rough edges as he falls in love with Goldie. He becomes a mentor and pal to - The Dead End Kids. Familiar screen characters to pre-war moviegoers.<br /><br />A chance to make money arises when an exhibition boxer shows up challenging any suckers to last several rounds in the ring with him. It's a natural temptation for Bradfield/Dorney but there's a fly in the ointment. Who should show up but New York detective Monty Phelan, the laughing stock of the department? He's been on morgue duty for ages because of a slight mistake early in his career that sent an innocent man to Old Sparky (we all make mistakes, don't we?) Phelan recognized Bradfield from a news photo and he's there to watch the fight and make the pinch. Claude Rains is the cop who's endured slights and barbs from his fellow officers for years.<br /><br />What follows is predictable but it's well acted. I hope this was a main feature when it was released-it's too good to rank as a ""B"" second on a marquee.<br /><br />Busby Berkeley, best known as an outstanding choreographer, directed ""They Made Me a Criminal"" and Max Steiner, one of Hollywood's all-time prolific score composers, wrote nice but not extraordinary music for the film.<br /><br />Now available on DVD from Alpha Video, the movie set me back a mere $4.99 and gave me real pleasure. I'll view it again.<br /><br />8/10",id,imdb,pps
102,imdb,snli,"The most disposable movie in the history of cinema?This one is a strong contender!Why wasting so much money for such a pointless useless work? The only difference between the HItchcock classic and this poor imitation is color,wide screen and Leila's Walkman!!A movie which's supposed to generate thrills and fear leaves me completely indifferent.<br /><br />No you' re going to tell me it will urge the young generations to see the original?balderdash!This ""psycho 1998"" is a giant spoiler.<br /><br />They could have done something different,for instance ,by casting an actor closer to Bloch 's Bates ,an obese man.They content themselves with an obnoxious rehash!A pox on it!and long live Alfred Hitchcock!",id,imdb,pps
103,imdb,snli,Two girls are in line about to order at a Mexican eatery. Two sad girls are in line about to order at a Mexican eatery.,ood,snli,pps
104,imdb,snli,Two girls are in line about to order at a Mexican eatery. Two boys are in line about to order at a Mexican eatery.,ood,snli,pps
105,imdb,snli,A guy is standing in front of a toilet with a coffee cup in one hand and a toilet brush in the other. A man is attempting to brew coffee.,ood,snli,pps
106,imdb,snli,Two men are sitting on a grassy hillside wearing bike helmets. Two women are sitting on a grassy hillside wearing bike helmets.,ood,snli,pps
107,imdb,snli,Two people are walking up a mountain. Two dogs are walking up a mountain.,ood,snli,pps
108,imdb,snli,A person with dark hair is standing on the sidewalk in front of an orange and white truck. The man is standing on the sidewalk.,ood,snli,pps
109,imdb,snli,A man in a hat and jacket standing on the sidewalk with a pile of trash in front of him. The garbage man is picking up the trash.,ood,snli,pps
110,imdb,snli,Families waiting in line at an amusement park for their turn to ride. People are waiting to see a movie.,ood,snli,pps
111,imdb,snli,A man is reading a newspaper in a car dealership. The man is waiting for his car to be serviced.,ood,snli,pps
112,imdb,snli,The quarterback of the UTEP football team is about to be tackled by a member of the Wisconsin defensive team. The quarterback is about to be tackled by the opposing team.,ood,snli,pps
113,imdb,counterfactual-imdb,"Following his role in the fine caper SEVEN THIEVES (1960) – which I’ve watched several years back – Edward G. Robinson seemed to be stuck playing elderly criminal mastermind types (apart from the odd juicy role as in THE CINCINNATI KID [1965]). I’d previously watched the pretty good “Euro-Cult” effort GRAND SLAM (1967) and, apart from this, I’ve yet two more similar titles from Italy to check – one of which was directed by future goremeister Lucio Fulci! Anyway, this is the kind of international production – featuring American and Italian actors and a British director – which was prevalent during the 1960s; it’s harmless and easy-going in itself but hardly memorable and definitely overlong – especially since to procure finance for the heavy-duty equipment required for the heist (such as an army tank and an airplane!), the gang involved have to pull a variety of minor thefts first.<br /><br />The gang, of course, is an incompetent lot led by an American (Robert Wagner) and his bimbo girlfriend (Raquel Welch) – the others are a ‘pacifist’ black man, a perennially hungry Italian and a diminutive Englishman. They try to induce an ex-gangster (Vittorio De Sica) to turn over his fortune to them, except he’s destitute…but, under the auspices of “Professor” Robinson, he proposes instead a caper of 5 million dollars’ worth of platinum! Needless to say, the gang members don’t trust one another (Wagner instructs Welch to seduce De Sica so as to get the name of their fence in Morocco – where they are to retreat after the robbery), or else bungle the job (commissioned to hold up a restaurant, the Italian can’t resist sitting at table and order a multi-course meal for himself!). Amusingly, in the face of similar failures, De Sica tries to show them how they used to do it in the old days – however, ostensibly holding up a petrol station, it transpires that the owner is a nephew of his and he merely asked to borrow some cash! <br /><br />The central heist sequence is typically elaborate: while the gang, including Welch, ‘take’ the train transporting the platinum, Wagner kidnaps pilot Victor Spinetti and his airplane. When the job is done, he fully intends to double-cross De Sica – but neither his partners nor Welch herself are willing to go along with this, so he’s forced to relent. Coming from the time when crime didn’t pay, the gang contrives to lose all their stash in mid-air when the plane’s bomb-bay doors are accidentally opened…",id,imdb,common
114,imdb,counterfactual-imdb,"This is another of Eastwood's many movies mixing intrigue, action, and a dollop of romance, along with ""The Gauntlet,"" ""Firefox,"" and so forth. Clint's acting range by now is pretty familiar. In this one, he's taciturn and a bit outrageous, especially with women and superiors. There are no surprises in his performance. But the film itself is something of a surprise; it's above average. <br /><br />Clint is Frank, a Secret Service agent who, perhaps in a moment of doubt, failed to catch the bullet that killed JFK. He then took to drink, which drove his family away, and now plods along in the bureaucracy until he is contacted by John Malkovitch, calling himself ""Booth,"" who strikes up a sort of skewed relationship with him based on their shared, disillusioned conviction that everything is meaningless except the impulse to escape dreariness and predictability. Now, this is rather an anfractuous set of attitudes for a performer like Clint to project, but he does rather well, less robotic than usual. And he does seem to carry around with him, like a burden of stone, the memory of that moment in Dallas. He's tested again halfway through this movie. He is hanging from the roof of a tall building, grasping Booth's hand, and he pulls his pistol and points it at Booth, who asks him if he is really willing to shoot. If he does, of course, he saves the president from an attempted assassination by a CIA-trained murderer, but he does so at the cost of his own life. Booth twits him about the situation as they hold hands in midair. And Clint even has a short speech, talking to Renee Russo, about his failure to save the president in Dallas. ""If I'd have reacted quickly enough, I could have taken that shot . . . and that would have been alright with me."" It's underplayed, but his voice chokes slightly, his eyes water, and his lip trembles. It's one of the few scenes in any of Clint's films that might properly be called ""moving."" We know from his newfound resolve that given another chance he would take the bullet this time. (The irony is that he doesn't like the current president. Who could? He gives pompous speeches in Colorado about how they ""carved a nation out of the wilderness."" Didn't they do the same thing in Las Vegas?)<br /><br />It's often said that a movie is only as good as its villain. It isn't true, nothing is that simple, but an argument could be made for its truth value in this case. The reptilian John Malkovitch with his Tartar eyes is marvelous.<br /><br />Talk about disillusioned. Okay, he can ham it up a little, sniffing with disdain even as he plugs two innocent hunters between the eyes, but he's fascinating on the screen. Renee Russo has little do to. Fred Thompson, as the chief White House aid, is now back in politics, a relief for movie-goers. If Clint's acting range is limited, Thompson's is something less. In every film he's been in, he wears the same solemn and dissatisfied expression, as if constantly plagued by some form of volcanic digestive disorder.<br /><br />The direction by Wolfgang Peterson is as good as it was in ""Das Boot,"" which is pretty good. There is a great deal of the usual suspenseful cross-cutting in the final shootout. And when Clint and Russo fall into an impassioned embrace in her hotel room and scuttle backwards towards the bed like two weasels in heat, Peterson playfully shows us their feet along with a succession of objects dropping to the floor -- not only the usual garments but handcuffs, guns, beepers, palm pilots, Dick Tracy wrist watches and other impedimenta. Interrupted, Clint lies back on the bed and sighs, ""Now I have to put all that stuff back on again.""<br /><br />Well written and worth watching.",id,imdb,common
115,imdb,counterfactual-imdb,"Yes!!!! Fassbinder and Ballhaus are at the top of their game, back in 1973! It's about the same subject, but in my opinion it's a much better movie than THE MATRIX (1999), at least it was 200 times cheaper! Very nice camera work by Michael Ballhaus and the wonderful ""Albatross"" by Fleetwood Mac at the end. Fassbinder is creating a very moody tone for the whole film. It's a shame this movie was never released on DVD. But now after 37 Years they finally came to the conclusion, that this TV-Movie, is not only one of the best Fassbinder films (altough there are quiet a lot best Fassbinder films), it's a brilliant example for a science-fiction movie, done without much money. Buy it!! Watch it!!",id,imdb,common
116,imdb,counterfactual-imdb,"One of the worst Arnold movies I've seen. Special effects were terrible. Script was horrible. Hopefully his next movie will be much better like T2, Total Recall, True Lies and Eraser(not as good as the rest). Watch Stigmata if you want to see an apocalyptic future movie. It's much better.",id,imdb,common
117,imdb,counterfactual-imdb,"I grew up in New York and this show came on when I was four-years-old. I had half-day kindergarten and this was on WPIX Channel 11 in the afternoon. I just loved the music and stories and remember humming them around the house when playing.<br /><br />I just saw part of an episode on YouTube and for a moment I could remember how it felt watching those shows as a small child. I, of course, stopped watching when I got in 1st grade because it was on before school got out (no VCR's or DVR's back then). I grew up, not realizing that the show was still on until I was in 11th grade! <br /><br />I also had no idea that there are DVD's and wish my nieces and nephews were young enough to enjoy this show, but now they're all past the demographic, or I'd buy all of them DVD sets. This was so much better than a lot of the kid shows today.",id,imdb,common
118,imdb,counterfactual-imdb,"remember back when this movie was made by robert downey senior. a very good entertaining black awareness feature, which, was an underground hit in california-los angeles, and new york at the time. a hippy loved classic where, changes which occur in the business world are striking, refreshing and interesting comedy.non compliant, not like basic society at the time of 1969 now watched, is still very good,but today's life in america totally diferent from 69. good for the baby boomers.",id,imdb,common
119,imdb,counterfactual-imdb,"I'm just throwing in this review to show that I'm not crazy -- I like a lot of Wynorski's work -- Deathstalker 2, Chopping Mall, Against the Law are fast-paced and highly enjoyable -- just to prove I'm not blind, I have to mention this, along with some Shannon Tweed ""Body Chemistry 3 or 4 or something"", are the lousy ones -- I've got nothing against drawn-out sex sequences, but Julie Strain's breasts are so unnatural looking you can't help but stare at them - which may be the desired effect but I didn't enjoy staring at them -- and several members of this cast seem depressed or disinterested -- The ""erotic thriller"" was the worst thing to happen to low-budget flicks ever, and thank God that their day has more-or-less done.",id,imdb,common
