,in domain,ood,text,domain,dataset,partition
234,sst2,imdb,"I did it too. When i first saw the band, i dismissed them straight away without even listening to the music. Then one day, out of sheer curiosity, i bought the cd and fell in love with it. So i bought the video. hold onto your lunch kids, this isnt going to be pretty! the video was excellent - a great opportunity to hear the music, see some of the promo videos, and meet the band...although i *still* dont know how they can cope with wearing those masks all the time! a must for all fans of the band, and fans of alternative music in general",ood,imdb,common
235,sst2,imdb,"Amitabh and Jiah Khan, raised great expectations, by their press conferences, though it was quite easy for the critics, and the fans too, that after all, this much hyped, Ram Gopal Verma Factory product, is going to fall flat on it's face, in all the probabilities ! Why, because Jiah was so immature and childish, and Bacchan, mixed up guilty, and unsure . they themselves didn't know, what the hell they were talking about, to the press, keeping up with the tag line, that some love stories are not to be understood, or some such rubbish ! Why the title is Nishabd ? Ramu needs to refresh his knowledge of Sanskrit, as Vidhu Vinod needs to study Mahabharata, tagging in line, another glorious flop of the year, Eklavya ! Comparison with the Sweet hearts, and Lolit's is inevitable, as the so-called plot line is supposed to have inspired by them. but sadly, Ramu has hardly made any serious effort, to delve deeply into the psyche of the aging, and the young ones. is lolly pop sucking the ultimate indicator of the innocence ? and contrary to that streak of childishness, the leg show at the dining table, with a Vijay, that is Bacchan in that role, bursting into squeals of shameless laughter incessantly after wards ? this girl, is in fact at her seductive game, luring poor Vijay to think, she is in love with him. the legs,too are skinny enough, and that act of putting the water hose through the legs, is down right obscene. it's beyond any one's understanding, how can a girl , coming as a guest to some body's house, can be so brazen, brash, and over powering ? and why the hell that stupid wife, played by Revathi, remarkably well, though scripted poorly, and characterized unrealistically, encourages her own husband, to dance with a sexily saying young girl ? that part of Vijay, trying to gain some refreshers to his humdrum life is absolute bullshit. because, apparently it seems that he is happy as he is, with a well settled life, and a hobby to recreate. This reminds of Blame it on Rio, the older daddy, and his young love, superbly played by Michael Caine. Bacchan looks terrible in close ups, and over all, where as kevin spacey and Jeremy Irons looked debonair and handsome, which is why the young chicks some times get attracted to older men, for their charming persona, compared to the vulnerability of young boys of their age. only good thing about this movie is those green , sprawling land scapes , winding roads, and pleasant cinematography. no substance, or even any sparkling show of emotions, drama , or even intriguing, stormy sex like in Lolita, this shallow movie has no wonder, fallen flat on it's face, and had to be wound up from the screens during first weeks ! next time round, before mindlessly copying any such theme from Hollywood, Ramu should do his home work, and Bacchan should think twice ! you can not fool all the people at all the times, Mr. Bacchan!",ood,imdb,common
236,sst2,imdb,"I'm from Ireland and I thought this film had the odd minute or two where accents where a little off but no worse than any Brad Pitt or other American doing the accent. Furthermore, I have rarely seen any British actor handle an American or Canadian accent except for Colin Farrel in Minority Report. This film is a little film and it was entertaining. No it wasn't a Blockbuster Hollywood production but frankly I'm sick of that shite. I laughed more than a few times and had a good time. It was definitely worth the rental. The main character is a spoof on other hard British gangsters. At least that's the way I saw it. If you go in expecting a $100 million dollar production you'll be disappointed. Enjoy it for what it is- a small entertaining film.",ood,imdb,common
237,sst2,imdb,"Count me as being one who is happy to see no Hastings in this episode. The poor-man's Dr. Watson does nothing for me, as he simply drags down every scene he's in. Japp is often necessary to the story as the representative of officialdom, and a little Miss Lemon is fine for seasoning, but Hastings swings from painfully dim to over-mannered in different episodes. If I have to sit through one more vacuous ""Oh, I say there!"" I'll take the gas-pipe.<br /><br />As a general rule, the more Poirot you get in a Poirot story, the better. Every line for Hastings is one taken away from Poirot. And I've never read the books, so I really don't care about fidelity to Christie's characters. A lot of viewers/reviewers seem to have a problem with separating the movies from the books. If you want the book as written, then read it. I don't see the point of watching the television version if you know what will come next at every stage. Theatre is not prose - don't expect a transcription.",ood,imdb,common
238,sst2,imdb,"Back in 1982 a little film called MAKING LOVE shocked audiences with its frank and open depiction of a romantic love story that just happened to be about two men.<br /><br />I have been waiting for years for a good, old-fashioned romance between two men; LATTER DAYS is all that and more.<br /><br />Yes, it is soapy, melodramatic, cliché-ridden, and quite corny. That is what makes it so wonderful. There is nothing like a good romantic movie, and this movie is romantic in the best sense of the word.<br /><br />As to the issue of religion, sorry folks, but these things do happen and are happening to gay people even now. It is not just the Mormon church that rejects its gay members. Gay people in every religion have faced harsh judgment and rejection.<br /><br />I loved this movie. It has a perfect blend of a fantasy-romance grounded in the reality of the day-to-day lives of the characters. If I could give it more than ten stars I would. Good love stories never go out of style; great love stories like LATTER DAYS are unforgettable.<br /><br />It's about time!",ood,imdb,common
239,sst2,imdb,"A Walt Disney MICKEY MOUSE Cartoon.<br /><br />STEAMBOAT WILLIE, a mischievous little rodent, neglects his pilothouse and frolics his way into cinematic history.<br /><br />On 18 November 1928, a struggling young genius debuted the world's first successful cartoon with synchronous sound. There would be no looking back for either Walt Disney or his alter ego Mickey Mouse. Financial struggles would remain, but essentially the world was their oyster bed and Mickey would eventually rival Chaplin as the most recognizable cultural icon of the century.<br /><br />As entertainment, STEAMBOAT WILLIE is still fun to watch, featuring fine work by animator Ub Iwerks and showing a Mickey with all the passions & indifference of a small child. He must deal with a tyrannical skipper (Pete, without his peg leg; he had been appearing in Disney cartoons since February of 1925), a wisecracking parrot (in a few years it would be a Duck) and a cute little Mouse named Minnie. Together the two rodents rather callously make music on the live bodies of a goat, cat, goose, piglets & cow (a precursor of Clarabelle) - all of whom happened to be conveniently on board the steamship. Audiences howled for more and the pattern was set for the subsequent Mouse cartoons of the next few years.<br /><br />******************************<br /><br />Walt Disney (1901-1966) was always intrigued by pictures & drawings. As a lad in Marceline, Missouri, he sketched farm animals on scraps of paper; later, as an ambulance driver in France during the First World War, he drew comic figures on the sides of his vehicle. Back in Kansas City, along with artist Ub Iwerks, Walt developed a primitive animation studio that provided animated commercials and tiny cartoons for the local movie theaters. Always the innovator, his ALICE IN CARTOONLAND series broke ground in placing a live figure in a cartoon universe. Business reversals sent Disney & Iwerks to Hollywood in 1923, where Walt's older brother Roy became his lifelong business manager & counselor. When a mildly successful series with Oswald The Lucky Rabbit was snatched away by the distributor, the character of Mickey Mouse sprung into Walt's imagination, ensuring Disney's immortality. The happy arrival of sound technology made Mickey's screen debut, STEAMBOAT WILLIE (1928), a tremendous audience success with its use of synchronized music. The SILLY SYMPHONIES soon appeared, and Walt's growing crew of marvelously talented animators were quickly conquering new territory with full color, illusions of depth and radical advancements in personality development, an arena in which Walt's genius was unbeatable. Mickey's feisty, naughty behavior had captured millions of fans, but he was soon to be joined by other animated companions: temperamental Donald Duck, intellectually-challenged Goofy and energetic Pluto. All this was in preparation for Walt's grandest dream - feature length animated films. Against a blizzard of doomsayers, Walt persevered and over the next decades delighted children of all ages with the adventures of Snow White, Pinocchio, Dumbo, Bambi & Peter Pan. Walt never forgot that his fortunes were all started by a mouse, or that childlike simplicity of message and lots of hard work always pay off.",ood,imdb,common
240,sst2,imdb,"We've all seen bad movies, well this one takes the cake. I've seen that Junior movie box staring back at many times from my many journeys to the horror section at the local video store, and I was a little interested, it looks like it pays some homage to Texas Chainsaw Massacre, so I thought I'd get it. Mistake! Junior sucks hard, long, and with commitment. In other words it's really bad. Although it does win my award for most creative use of a bikini top. AVOID!!",ood,imdb,common
241,sst2,imdb,"In a world full of films -- like ""You Got Served"" -- that blow your mind with its vast amounts of errors, you'd never figure that there would be worse films... until now. Ron Hall's ""Vampire Assassins"" does more than cheese you off. It KNOWS that you are mad at it. First: there are no assassins in this movie. In fact, there's only one good guy fighting in the whole movie. Second: The location... is basically one location: some jackass's house (or basement. It's up to you.). Third: The special effects (bluntly stated) can kiss my ass. Fourth: The acting beats ""Plan 9 from Outer Space"" in the worst-acting-ever category. Ron Hall can't act to save his life. Finally (and definitely not the smallest problem): THE EDITING. The person who edited this film better hope that I never find him. The cuts and shots are HORRENDOUS!!!! Other issues: Lighting (virtually none), the fact that the guy on the cover isn't even in the movie, and the fact that this film exists.<br /><br />To sum this film up, let us just say that I tortured the DVD copy before taking it back to Hollywood Video (don't worry! I used the MVP membership, so it was free!). NEVER SEE THIS FILM!!!!",ood,imdb,common
242,sst2,imdb,"it´s a movie to see on tv and only once.. i mean, it´s good, but it´s a little too lengthy and the plot is so well-known, it isn´t very original but it isn´t boring. the best thing of the movie are the performances, natalie portman and susan sarandon are great actress and in this movie they have done a great job. i give it a 7.",ood,imdb,common
243,sst2,imdb,it 's a bad thing when a movie has about as much substance as its end credits blooper reel . ,id,sst2,msp
244,sst2,imdb,"in the end , we are left with something like two ships passing in the night rather than any insights into gay love , chinese society or the price one pays for being dishonest . ",id,sst2,msp
245,sst2,imdb,"( lawrence bounces ) all over the stage , dancing , running , sweating , mopping his face and generally displaying the wacky talent that brought him fame in the first place . ",id,sst2,msp
246,sst2,imdb,the character of zigzag is not sufficiently developed to support a film constructed around him . ,id,sst2,msp
247,sst2,imdb,turns potentially forgettable formula into something strangely diverting . ,id,sst2,msp
248,sst2,imdb,ahhhh ... revenge is sweet ! ,id,sst2,msp
249,sst2,imdb,burns never really harnesses to full effect the energetic cast . ,id,sst2,msp
250,sst2,imdb,you do n't have to know about music to appreciate the film 's easygoing blend of comedy and romance . ,id,sst2,msp
251,sst2,imdb,"a quiet , pure , elliptical film ",id,sst2,msp
252,sst2,imdb,"though perry and hurley make inspiring efforts to breathe life into the disjointed , haphazard script by jay scherick and david ronn , neither the actors nor director reginald hudlin can make it more than fitfully entertaining . ",id,sst2,msp
253,sst2,imdb,"From the late teens to the 1920s, Stan Laurel was a solo act in films. During this time period, Laurel was definitely NOT among the upper echelons of talent and his humor isn't nearly as good as contemporaries such as Lloyd or Keaton. However, for second-tier short comedies, he did create a decent niche. As far as the quality of the films go, they varied wildly. Some, such as DR. PYCKLE AND MR. PRYDE, were terrific, whereas most were of average to below average in quality.<br /><br />FROZEN HEARTS is an odd film. Like many of the films he made for Hal Roach and distributed by Pathé during this period, the costumes were absolutely first-rate and the film looked very nice. However, despite this and having support from the likes of James Finlayson, one thing they forgot to include in this film was humor. None of the jokes seem to work and the film looks almost like a drama, not a comedy. Only the really silly intertitle cards betray the type film it's supposed to be.<br /><br />My advice is try to see all his Laurel and Hardy films and then see the solo films. In addition to DR. PYCKLE, try seeing THE SOILERS and MUD AND SAND--two of his more tolerable solo shorts.",ood,imdb,msp
254,sst2,imdb,"The final part of Kieslowski's trilogy based on the colors of the French flag finds the director at peace with the metaphysical and transcendent nature of the cinematic image. In Red, imagery is paramount, as well as the obvious but clever color coding. However, rather than adhering to empty aesthetic contrivances based on the 'cinema du look', Kieslowski's Red is a multi-layered, densely plotted meditation on the nature of fate and love. In Red, love and fate are intertwined but complex notions, dictated as much by the whims of human beings as the invisible parallel associations that seems to pass us by. You sense Red is really an allegory, a reenactment of Prospero's omnipresent gestures in The Tempest, yet it is more than its story appears. Red demands countless viewings, and in each viewing something new is discovered that weaves itself into the already immaculately plotted structure.<br /><br />Although Red stands alone as a masterwork from Kieslowski, it's best viewed as part of the trilogy. Elements of Blue and White are referenced in Red, which knowing viewers will enjoy.",ood,imdb,msp
255,sst2,imdb,"------ Spoilers----- Spoilers----- Spoilers--------just a few small ones <br /><br />Saw this on Satilite channel, missed the first 30 min of movie, will keep this comment short and informative.<br /><br />The movie is basically about 5 characters,The acting is very bad for afew characters. 1 girl with the help of another girl kidnaps 3 different people but it backfires and the 3 kidnap the 2. This is one of those types of movies where the script writers try to be thought provoking or philosophical, mysterious and ... you get the point; but do to their own, personal, lack in thinking they fall terribly short. Like one of the captives who is supposed to be some type of psychology nerd - looks the part but his tongue can't speak it. THe writers think that if the nerd uses a lot of 8 letter words amateurishly - unknowingly i believe - that the viewers will be ignorant enough to believe it. I wish i could give an example but i cant recall any - exactly as it was said. The ending was bad as well. But the one female captive acted her role as an old and relatively wise lady, although she, as well as the rest, had a lot of cliché s.<br /><br />So Why would i give this movie a 7 stars if I thought all the above? Simple, I give the entire seven stars to LISA KELLER - one sexy a$$ momma. SHE is FINE lol. I am an appreciator of beauty, and she is exactly that. But don't get me confused because I'm not a pervert and this movie is NOT a porno in any way. their is somethin about her I cant explain, but i like it. I remember the scene where a captive has broke free and as he looks for a way out, bumps into Keller. She tries to get way but she doesn't have a chance. He throws her down, kneeling on the stairs and he pulls her pants down, no panties ;). Now, although she has an AMAZING ass - and the this shot leaves little to the imagination for a long 30 seconds i think - it was her facial expression that got me. she wanted it, and that look had me thinking i was behind that. I would have torn that booty up! After that expression, i jus couldn't look at her objectively anymore, I WAS IN LOVE. lol. I am glad to have seen this movie but if Lisa Keller wasn't playing the lead role, I would have changed the channel.. well... after i had seen the scene i mentioned above. I am a LISA KELLER fan know, but is seems that she isn't a consistent actor, seeing this 2003 movie is her latest. But i am lookin forward to another movie with her in it.",ood,imdb,msp
256,sst2,imdb,"To keep it as simple as possible. This is a very good show. That is well written, and has a fantastic cast. It's not loaded with blood and guts. And centers around a disgraced cop and his relationship with his ex-wife, his son, his former partner (Andre Braugher), his childhood friend, now a priest (George Dzunzda), and lastly the person who happens to get into his hack in that episode. Are you likely to find something like this going on in your city NO. Is this still a good story YES. And it's nice to see a man portrayed as good father in spite of his flaws. Watch more then one ( 2-3) and you'll see why a lot of us are hooked on this show. And thank you David Morse for making this character so interesting. Another good job!",ood,imdb,msp
257,sst2,imdb,"Not good. Mostly because you don't give a damn about what happens to all these people. Some comments : 1. I am tired of seeing governesses who never talk to their pupils, never teach them anything and take a tired and annoyed look whenever the said pupil, who of course has been won over in the space of 4 seconds, says something 2. Fine, so Rosina has a father complex and therefore is attracted to her employer. But Charles is completely different in all aspects from her father - if anything Henry is much closer as a sensual, exalted person 3. How could you ever believe that she would be more attracted to Tom Wilkinson than to Rhys Meyer. 4. Hard to believe, if she had been in fact raised as a deeply religious girl, that she would be so careless about sleeping with a gentile after knowing him for 5 minutes.<br /><br />Some good things about the film : At least she didn't end up pregnant, not knowing who the father was... The whole description of life in the Jewish community in London is good",ood,imdb,msp
258,sst2,imdb,"Dolelemite (1975) is a cult classic. Starring Rudy Ray Moore as the pimp superhero out to wrong rights whilst challenging the MAN along the way. He has two enemies, that no good Willie Green and the sleazy mayor. Watch Dolemite kick, punch, slap and pimp his way across the screen. What's the man's name? DOLEMITE!<br /><br />Interesting film that paved the way for a generation of rappers and performers. To sell more of his party albums, Rudy Ray Moore made several on the cheap films during the seventies. Self produced and marketed he catered towards a specific audience. Some people call it blacksploitation others call it trash, I call it entertaining. Dolemite was followed by the semi-sequel The Human Tornado and a direct to video Return of Dolemite 25 years later.<br /><br />Highly recommended, a definite cult classic! <br /><br />Footnotes, if the film was properly matted on video you wouldn't see the boom mikes. Dolemite was cut to receive an R-rating.",ood,imdb,msp
259,sst2,imdb,"Nurse Charlotte Beale(the lovely Rosie Holotik)has arrived to Dr. Stephens' clinic for the insane prepared for a new job. What she doesn't expect is to find another supposed doctor in his position after Stephens is attacked by axe-wielding maniacal ""judge"" Oliver W Cameron(..in a running gag, anytime he confronts a situation out of his control, he retreats to repeating his name). That doctor is Geraldine Masters(Annabelle Weenick)who isn't sure about whether Beale is a proper fit for their establishment. After a long discussion about the position(which is quite an awkward scene as the two debate about Beale's being sent a letter by Stephens getting a job at the clinic with Masters often reminding her that he is no longer in charge)Masters agrees to let her work in the nursing position, but the good Doctor may not be who she seems..<br /><br />The assortment of loonies includes Sam(Bill McGee)a simple-minded child-man who was Stephens' last victim of lobotomy, Jennifer(Harryette Warren)a woman who needs an adult to comfort her as she wallows at Masters' heel like a puppy, Danny(Jessie Kirby)a trouble-making annoyance often trying to steal the fake baby of disturbed Harriet(Camilla Carr), Allyson(Betty Chandler)a sexy nympho who just wants to be loved and hops at any man she sees, & ""Sergeant"" Jaffee(Hugh Feagin)your typical case of soldier who hasn't escaped the madness of war.<br /><br />The film shows Masters' unorthodox methods of running the clinic with allowing the patients to roam free with the doors to all rooms without locks calling into question..and, not to mention, the fact that Oliver is still allowed to walk around despite just chopping Dr. Stephens with an axe. And, what exactly happened to Dr. Stephens? Ah ha..<br /><br />Tacky 70's drive-in trash is a lot of fun if you are into a warped brand of cinema. I'm attracted to bizarre flicks about mental rejects because of their unpredictable nature..you just never know what the hell might happen, especially in this case where they are allowed to roam often unattended. Some consider the low budget a liability, but in the case of this film, I think it enhances the experience. With the cheap photography and weak production values(being shot for peanuts in a run down house in some awful location)it seems creepier and I felt like a voyeur peering into insanity through a camera lens on the outside looking in.",ood,imdb,msp
260,sst2,imdb,"My entire family enjoyed this film, including 2 small children. Great values without sex, violence, drugs, nudity, or profanity. Also no zillion dollar special effects were added to try to misdirect viewers from a poorly written storyline. A simple little family fun movie. We especially like the songs in the movie. But we only got to hear a portion of the songs ... Mostly during the end credits... Would love to buy a sound track CD from this movie. This is my 4th Bill Hillman movie and they all have the same guidelines as mentioned above. With all the movies out there that you don't want your kids to watch, this Hillman fella has a no risk rating. We love his movies.",ood,imdb,msp
261,sst2,imdb,"Barbershop 2: Back in Business wasn't as good as it's original but was just as funny. The movie itself lacked little things which the original held which made it much more enjoyable. Back in Business seemed to be just another worthless sequel made to bring in money with a very thin plot. Cedric the Entertainer's terrible excuses for flashbacks ruined the movie and seemed to be a bad way to try and get the audience to adapt more with the character. Overall Barbershop 2: Back in Business was a sequel not needed, without the originals charm, soul & spark.",ood,imdb,msp
262,sst2,imdb,"I loved this movie and i never knew it was this old it came out the day n year i was born in and now i am 19 now i still love this movie especially the songs like ""My Mother"" and ""Boys and Girls of Rock N Roll"" and i remember as a kid i believe i was 5 n my sister was 6 and my cousin (boy) was 6 as well we used to pretend to be the characters in the movie i was Eloner and Janette and my sister was Britany and my cousin was Alvin Simon and Theodore those were good times and i miss it and having this movie reminds me of the good times since my cousin is old for this stuff and so am i and my sis we are not going to forget about the chipmunk and the chipmunk movie i still even remember the songs and the words off by heart even though i haven't seen this movie for 12 years but now starting to love it again ALVIN AND THE CHIPMUNKS AND CHIPETTES <3<3<3<3",ood,imdb,msp
263,sst2,imdb,"macdowell , whose wifty southern charm has anchored lighter affairs ... brings an absolutely riveting conviction to her role . ",id,sst2,pps
264,sst2,imdb,"( næs ) directed the stage version of elling , and gets fine performances from his two leads who originated the characters on stage . ",id,sst2,pps
265,sst2,imdb,there are some wonderfully fresh moments that smooth the moral stiffness with human kindness and hopefulness . ,id,sst2,pps
266,sst2,imdb,will amuse and provoke adventurous adults in specialty venues . ,id,sst2,pps
