,in domain,ood,text,domain,dataset,partition
175,imdb,rte,"***SPOILERS*** ***SPOILERS*** There must have been something in the air in the immediate postwar years that made night cities attractive settings for movies. A gaggle of nocturnal, urban films were made at that time, and not just in America. One of the most notable was Carol Reed's Odd Man Out, an English picture about a wounded gunman staggering through the streets of Belfast. In America it was the high noon, or more properly, high midnight, of film noir.<br /><br />Crossfire isn't really film noir, but has the trappings of noir, though it uses them for its own aims, which have to do with bigotry. Directed by Edward Dmytryk, written by John Paxton, it was adapted from a novel by Richard Brooks. The book concerned the murder of a homosexual; in the movie the victim is changed to a Jew. Though filmed like a mystery there is little suspense in the film, as it is fairly obvious who the murderer is early on. What makes the film so watchable and beautiful is its evocation of a city, Washington, D.C., just after World War II, by some of the most gifted craftsmen working in films at that time. Unlike many night movies Crossfire is set mostly indoors: in police stations, rooming houses and all-night movie theaters. Soldiers are everywhere in the film, and most are itching to get back to their civilian lives. Yet one senses, from most of the men we meet, that their personalities have been so shaped by their military experience it's going to be tough for them to return to their old neighborhoods; for some maybe even impossible. They seem more bound to one another than to anything or anyone else.<br /><br />Yet some men never truly bonded with anyone in the military. The murderer, Monty, is one such individual. One senses that he was never connected in his civilian life, either. He is a lone wolf who also needs people. Desperately alone, he has a sadistic streak a mile wide, and always needs someone nearby to be the butt of his jokes. The man he kills did him no harm, and was in fact a stranger to him. But once Monty figured out the man's religion, that was enough. He didn't really mean to kill the guy, as it was his intent to 'merely' humiliate him and just beat him up. But as he was quite drunk at the time, Monty's fists got the better of him. It is this act that sets the story the story in motion.<br /><br />Once the movie builds up a head of steam the other characters come rapidly into focus. Monty's opposite number is Keely, another soldier, who, though introspective like Monty, and somewhat detached, harbors no resentment toward anyone and seems a reasonable, even amiable guy. Finley, the pipe-smoking homicide detective, is dandyish and a tad effete compared to the men in uniform, but proves more than a match for the various and mostly recalcitrant soldiers he deals with. The actors who plays these roles, Roberts Ryan, Mitchum and Young, give excellent performances, each in a different key. Ryan, as Monty, is tense and paranoid, always looking around for someone to pick on; and one can feel his anxiety over becoming a victim himself. As Keely, Mitchum is low-key, almost nonchalant; he never raises his voice; and he seems to have more to say, more to offer, than is permitted by the script. Young's performance has often been criticized as being too soft, but I find it deceptively strong and nicely offbeat. He cuts against the stereotype of the hardboiled cop, and makes the character of Finley a bit of a prince of crime detection.<br /><br />There are few surprises in Crossfire, though the script is at times surprisingly well-written, even brilliant. Character actor Paul Kelly gives one of the best short performances in the movies as the 'boyfriend' of a woman a soldier picks up in a bar. Kelly may or may not be her husband; and he may or may not live with her, though he seems relaxed enough in her apartment. The beauty of these scenes are that nothing is made clear, and this man himself seems more than a little confused over what his role is, was or ought to be. In a way these few scenes form the thematic core of the film, which is anomie. With the exception of the detective all the men in the film are drifting, aimless and basically lost, some more seriously than others. In this respect Crossfire is, for all the preaching near the end, a film about the vagueness of identity, and how easily it can be lost or warped. Men drift from one bar to another in this film, as they engage in a sort of woozy camaraderie, their personalities merging into a kind of general American male template. Then something happens, something is nailed down. A word is mentioned, whether 'Jew' or 'hillbilly', and things suddenly turn tense, and the very notion of individuality, of an identity outside the group, of anyone not like them, becomes deeply offensive, even loathsome. Then, after tempers flare and whatever stirred them up has been resolved or forgotten, the men revert to their loose, non-personal group normality, and order is restored.",id,imdb,common
176,imdb,rte,"For many year I saw this movie as a real movie of ninjas but after study more about this culture I can only think this is just another karate film. A black shinobi and some weapons doesn't make a ninja, it's much more than that. The ninja are the most dangerous warrior of the japan because they are trained in every aspect of life to survive to anything, killing whatever try to stop them. This movie is not a about a ninja warrior just about a clown trying to be something he cannot even understand.",id,imdb,common
177,imdb,rte,"Apparently a B movie ...B must stand for Better acting and a Better message than we get in big budget ""A"" pictures today. Modern-day movies aimed at young women, surely aren't designed to encourage depth of character over shallow self-serving behavior... or increase the self-esteem of young girls who don't conform to ""feminine"" standards. (After all, criticizing the fake and flashy, like this movie does, ain't gonna help sell more products that depend on girls *not* being satisfied with their natural attributes or inner beauty.) <br /><br />Laraine Day is lovable as a mechanically inclined tomboy who ""bounds"" into rooms and confesses to an inability to flirt. She bonds with Robert Cummings due to similar interests, a shared sense of humour, and her honesty, loyalty and good friendship, which he gradually comes to value over the superficial ""charms"" of her selfish glamour-girl sister (who only brings out his own selfish, reckless playboy tendencies).<br /><br />Although Laraine is outwardly beautiful as well, it's refreshing to see inner beauty valued more, and the depiction of true friendship leading to the most fulfilling romantic relationship. I wish young girls (and guys) were getting this kind of down-to-earth message today.<br /><br />Maybe if Hollywood returns to making ""B"" movies again, with modest budgets, and tries to be content with modest profits... what am I saying? Sacrificing the blockbuster mentality to create something sincere on a smaller-scale, would be like expecting a guy to give up the shallow sexpot for a sweet girl who really cares about him. That's crazy talk.<br /><br />Please, somebody invent a time machine already! I belong in 1940.<br /><br />I'd rate this movie higher, but the ending is a bit too abrupt, and perhaps lacked sufficient indication of Robert Cummings' change of heart. (I like the fact that B movies are short & snappy, not bloated & self-indulgent, but this one might've needed more than 70 minutes.) Also found it somewhat unrealistic that a widow and young children would be so unaffected by a sudden death in their family...or be so forgiving of the one who caused it. I mean, I guess it's *nice*, but a little more grieving or bitterness would've been only natural. Maybe a deliberate choice to make this family act lighthearted about their loss, to lessen the impact of the tragedy and make sure *we* forgive those involved in the death - since it's just a plot device anyway, not the real point of the film. Still strange though.",id,imdb,common
178,imdb,rte,"(Some Spoilers) It took some 19 years for Bruce Campbell to finally put his masterpiece "" Man with the Screaming Brain"" on the screen. But Campbell had to alter his story by having it, due to financial problems, take place in Sofia Bulgaria not where he initially wanted it to be filmed in Los Angeles California.<br /><br />In the film Burce Campbell plays US pharmaceutical tycoon Willian Cole who travels together with his spoiled rotten wife Jackie, Antoinette Byron,to the former Communist Republic of Bulgaria. It's there that William wants to help finance Bulgaria's almost non-existent mass transportation system.<br /><br />It's poor William's misfortune to get involved with both Gypsy woman Tatoya, Tamara Gorski, and her ex-boyfriend Yegor, Valdimir Kolev, an ex-KGB taxi driver. The two, William & Yegor, will unwittingly end up shearing their brains, inside William's skull,because of Tatoya's jealousy and vindictiveness.<br /><br />After Tatoya murders both William and Yegor their bodies are delivered to mad scientist Dr. Ivan Ivanowitch Ivanov, Stacy Keach, by his loyal assistant Pavel, Ted Raimi, to have their brains experimented with. Dr. Ivanov has this theory in that two heads are better then one. And now with the material, William & Yegor, available to him Dr. Ivanov at last is finally going to prove it. What Dr. Ivanov is going to sadly find out is that by fusing the two heads, or brains, together their brain waves will overlap and cause them to not only malfunction but turn against each other!<br /><br />William with Yegor's right lobe fused into his damaged brain is out to find Tatoya and make her pay for the damage she caused both him and Yegor. Yegor for his part is stuck in William's head who's likes and dislikes, in both food and drink, are totally opposite to his own. This causes a lot of tension and hostility between the two brains in them fighting for control of William's body!<br /><br />Things get even more screwed up when Jackie finding out that Tatoya murdered her husband William confront her in the dangerous and high crime section of Bravoda call Gypsy Town and ends up being murdered herself. Brought back to Dr. Ivanov by his assistant Pavel it's determined, with no body available,to plant Jackie's brain inside of an experimental robot that Pavel's been working on. The operation is a rousing success but the only drawback is that Jackie, with her brain inside the robot, has to have her brain recharged every few hours! Or, like a real brain lacking oxygen, she'll die together with the robot's batteries.<br /><br />Combination 1930's-like screw-ball comedy and horror flick with both William & Yegor turning the Bulgarian town of Bravoda upside down in trying to find Tatoya and make her pay, with her life, for the sad state of existence she put them both into. <br /><br />***SPOILER ALERT*** It's Dr. Ivanov who in fact saves the day by discovering how to keep the two brains from fighting, and thus cooperating, with each other! This is done by him instead of fusing the brains together Dr. Ivanov keep them independent by implanting a neutralizing cell wall in between the two uncooperative globs of gray matter.",id,imdb,common
179,imdb,rte,"Don't ask me why I love this movie so much...Maybe it came at a time in my life I desperately wanted to fit in, maybe it is the amazing monster effects, maybe because I enjoyed the novel ""Cabal"", but It's probably because I LOVE Clive Barker. I think it's fair to warn you the movie and the novel have no true resolve and like me you'll probably have a WTF moment at the end. At least two sequels were planned but never came about due to the fact the movie flopped for a few reasons. The studio made drastic cuts to the film cutting a good 30 or so minutes out of it and they did a HORRIBLE job promoting it. The adverts made it look like just another cheap slasher showing mainly the ""Button face/Mask"" Decker character. This is a movie about the monsters! About fantasy! About a place called Midian! It's a story where the monsters are the good guys. There is truly nothing else out there like it! It's not a movie for everybody I suppose but it stands as one of Clive's many great works. Sit back and be prepared to be taken to Midian - where the monsters are.",id,imdb,common
180,imdb,rte,"How 'Thursday' managed to avoid attention remains a mystery. A potent mix of comedy and crime, this one takes chances where Tarantino plays it safe with the Hollywood formula. The risks don't always pay off: one character in one sequence comes off inappropriately silly and falls flat. In the lead role, Thomas Jane gives a wonderful and complex performance, and two brief appearances by Mickey Rourke hint at the high potential of this much under- and mis-used actor. Here's a director one should keep one's eye on.",id,imdb,common
181,imdb,rte,"As this movie unfolds you start to feel the conundrum of human existence. If you carry with you questions, inner wars, unsolved puzzles about the meaning of life then you will feel this movie with every morsel of your body. Charles Darwin begins a war with an utterly predictable ending. War with God. His theories resemble the fact that God has nothing to do with mankind, has nothing to do with the amazing World that we live in. Savage, harsh, ironic and chaotic, this words surround the mind of the character thrown into an universe of material truth, who slowly pushes hope for God, out from his mind. Nevertheless, the movie as Charles Darwin, still sees wonder and beauty beyond God in the universe of infinite Evolution.",id,imdb,common
182,imdb,rte,"It is not always certain that by mixing comedians together you will produce laughter. The comics involved have to actually like or admire each other, or be willing to put up with each other's crankiness. GO WEST with the Marx Brothers had Buster Keaton write the script as a gag man. Groucho did not think too highly of Keaton's ideas, and embarrassed him at a script meeting. And though some of Keaton's gems still appear in the finished film (such as the gun that turns into a brush that turns into a gun) the film was one of the weakest the Marx Brothers ever made.<br /><br />A better film, but also affected by dueling comic egos, was W.C. Fields and Mae West in MY LITTLE CHICKADEE, which jettisoned the script for a series of duels of one liners between the leads. But the one liners were equally funny, so the film remains a success.<br /><br />But SIX OF A KIND is an example of six film comics who worked well together. The reason is simple: it is really three comic teams working together: Charlie Ruggles and Mary Boland, George Burns and Gracie Allan, and W.C. Fields and Alison Skipworth. Ruggles and Boland were paired in about half a dozen comedies during the 1930s, usually with Boland as a somewhat bossy wife, and Ruggles as a nervous wreck of a husband. Fields (usually a single act) was paired three times with Skipworth (TILLY AND GUS and IF I HAD A MILLION were the other two times). Skippy always figured out how to control or counter the larcenous activities of her man - it the present film she takes action into her own hands with the stolen money that is being searched for (she knows that the local sheriff, Fields, is not the one to trust with this). As for Burns and Allan they manage to effortlessly involve themselves with the put upon Ruggles and Boland on their cross-country trip by car.<br /><br />Ruggles quickly gets to realize what a mistake it was to agree to travel with Gracie - at one point she manages to cause him to fall off a cliff, and dangle from a branch. He is relatively helpless when she insists on 1) photographing him on his perch, and 2) correcting his grammar. The presence of George and Gracie's humongous dog (""Ran Tang Tang"" is it's name) does not make travel arrangements easier for Charlie and Mary.<br /><br />Fields has some choice moments. When he insists on shouting at the quartet, he says he's allowed to do so - he's the sheriff! He also explains, during a pool game, the improbable story of how he got his undeserved moniker ""Honest John"". You have to listen carefully to the tale, as it is interrupted with his attempts to play pool a few times (once getting accidentally beaned by a billiard ball), but it does show that there were items that even Fields would have had no reason to steal.<br /><br />Oh, in the ""Summary Line"", I mentioned a forgotten actor named Bradley Page - he was the man who is responsible for the trouble that Charley Ruggles is suspected of. Bradley has to have a reason to leave town in order to catch up with the unwary Ruggles and Boland, so he telephones his girl friend. He tells her to call back his job and say that he has to leave town because somebody has died. There is a pause as he apparently hears a question shot back by the girlfriend. ""ANYBODY!"", he says - clearly annoyed. Although the bulk of the humor in the film is carried by the sextet of performers, Mr.Page happened to have the most amusingly unexpected line in the film.",id,imdb,common
183,imdb,rte,"'Night Crossing' is about an enormous barrier designed not to keep enemies out but to keep its own people in<br /><br />'Night Crossing' is about a very long border fencer equipped with silent alarms and automatic firing systems<br /><br />'Night Crossing' is about the denial of the basic human rights of life, liberty, and the pursuit of happiness<br /><br />'Night Crossing' is about the fear and pain that afflict so many families<br /><br />'Night Crossing' is about one attempt to risk a crossing through the border zone<br /><br />'Night Crossing' is about a loving father whose only desire is to give his boys what should never have been taken away from them<br /><br />'Night Crossing' is about a disturbed mother who wants her babies and her husband alive<br /><br />'Night Crossing' is about a caring husband who wants his family to be together but in a better place<br /><br />'Night Crossing' is about children who want to be free to reach at anytime the sky<br /><br />'Night Crossing' is about a hot-air balloon handcrafted and built by two families <br /><br />'Night Crossing' is about a balloon which could go just high enough to crash or catch fire and explode<br /><br />'Night Crossing' is about two determined men who want their family to climb into a hot air balloon and float away to 'liberty'<br /><br />'Night Crossing' is about the fear of getting caught by an evil regime<br /><br />'Night Crossing' is about a sensible man who can't let bad dreams stop him<br /><br />'Night Crossing' is about an icy policeman who wants every lookout tower on full alert<br /><br />With exquisite music by Jerry Goldsmith, Delbert Mann's 'Night Crossing' makes us realize the true value of freedom<br /><br />Final thoughts: <br /><br />There are a few moments in everyone's life, certainly in public lives, that can define a person...<br /><br />For those of us old enough to remember the Reagan presidency, seeing the clips again in the wake of his death makes it seem like those events happened just yesterday, or last week. The voice, the expressions, are all so familiar. But for a large percentage of people, these events might as well have happened fifty years ago, if not more. They are part of the distant past. President Reagan is a name, and not much more. President Gorbachev is another name, and not much more. So how can we remember these two men who had such a huge impact on their country?<br /><br />Reagan and Gorbachev worked together to tear down the Berlin Wall and to steer their superpower nations away from nuclear confrontation",id,imdb,msp
184,imdb,rte,"Wow. We watched this film in the hopes that it would have at least some decent rock climbing scenes. We were disappointed there, but it was still a great movie! It was soooo cheesy it was great! I haven't laughed so hard at a movie in a long time. If you are into rock climbing, and you enjoy cheesy movies, then this one is absolutely for you!",id,imdb,msp
185,imdb,rte,"I have to give this movie a 4 because of a couple of things.<br /><br />1. What I'll call the ""stupid victim syndrome"". If you have the killer on the floor and you have his gun - shoot him please. If you are a cop and you have your shotgun pointed at the killer's back - shoot him please.<br /><br />2. When you are in a high stress situation and you have your finger on the trigger of a gun - your first instinct is to squeeze. This is one of the first things they teach you in handgun training and the reason that you don't put your finger on the trigger until you are ready to fire - ask any hunter or infantryman. If you are electrocuted, your muscles should also contract - making you squeeze your finger.<br /><br />3. It's really hard to lay on the floor completely still for 8 hours without 2 other people - one of them a doctor - not noticing that you aren't dead. Even more so if you are supposedly dying of a brain tumor and were in the hospital just a few months earlier.<br /><br />4. Technically, the killer did kill one of his victims - the guy he injected with poison that had to get the antidote. If you poison someone, that is murder.<br /><br />5. What was Adam's lesson that he was supposed to learn? Yes, the doctor needed to be there, but what was Adam's crime? Maybe I just missed something.<br /><br />Other than those things, I would have given this movie a higher grade. The plot was pretty good, and the ways the killer chose to kill his victims were very inventive. I can even forgive the terrible acting on the doctor's part - the scenes with his family were enough to make me sick. The cinematography and soundtrack were very good, but the ending seemed contrived and just didn't work for me. Thank goodness I didn't have to pay to see this or I would have demanded a refund.",id,imdb,msp
186,imdb,rte,"My daughter liked it but I was aghast, that a character in this movie smokes. As if it isn't awful enough to see ""product placement"" actors like Bruce Willis who smoke in their movies - at least children movies should be more considerate! I wonder: was that intentional? Did big tobacco ""sponsor"" the film? What does it take to ban smoking from films? At least films intended for children and adolescents. My daughter liked it but I was aghast, that a character in this movie smokes. As if it isn't awful enough to see ""product placement"" actors like Bruce Willis who smoke in their movies - at least children movies should be more considerate! I wonder: was that intentional? Did big tobacco ""sponsor"" the film? What does it take to ban smoking from films? At least films intended for children and adolescents.",id,imdb,msp
187,imdb,rte,"Yeah it may not be for adults, and some adults may find it stupid, but if you don't think about it it's really not that bad.<br /><br />The story has Alvin and his gang, going across the world, in search of jewels for a bad person, and the misadventures that they come in contact with.<br /><br />So the animation is good, and the story is cute, and the songs are forgettable but it's a good movie.<br /><br />I give it a 6 out of 10 or *** out of 4 stars.",id,imdb,msp
188,imdb,rte,"Low budget, mostly no name actors. . . this is what a campy horror flick is supposed to be all about. These are the types of movies that kept me on the edge of my seat as a kid staying up too late to watch cable. If you liked the 80's horror scene this is the movie for you.",id,imdb,msp
189,imdb,rte,This movie turned out to be better than I had expected it to be. Some parts were pretty funny. It was nice to have a movie with a new plot.,id,imdb,msp
190,imdb,rte,"I would love for members of the cast and crew to sit down and do an audio commentary on this movie! All of the different places that they went to film this movie! Should provide for some very good anecdotes! Fans of this movie would love to know:<br /><br />What kind of permission did they have to get to film at certain locations?<br /><br />Were there any memorable outtakes?<br /><br />Were there any scenes that were deleted?<br /><br />What challenges did the cast and the crew face?<br /><br />Did any actors have stunt doubles?<br /><br />What was it like to work with other members of the cast?<br /><br />Were any of the scenes ad libbed?<br /><br />What are members of the cast and crew up to now?<br /><br />What locations are still there, and what locations are no longer there, or are now a different business?<br /><br />It is one thing to read trivia about this movie on this site and other web sites. But there is just no comparison to getting it straight from the horse's mouth!<br /><br />Come on, guys! Get together and do a commentary! Never walk away from a challenge! Go for the gusto!",id,imdb,msp
191,imdb,rte,"So this guy goes into a psychiatrist's office for his first appointment. After the paperwork is done, the psychiatrist says ""I'm going to show you ink blots. Tell me what you see in them."" ""Well, says the patient,"" looking at the first one, ""I see a man and a woman having sex."" On seeing the second one, he says ""I see two women having sex."" On seeing the third, he says ""I see two men having sex."" On seeing the next one, he says ""I see two men and two women having sex."" The psychiatrist puts down the the inkblots. ""So,"" he says, ""We'll start by discussing your monomania."" ""MY monomania?"" says the guy. ""And you with all these dirty pictures!"" That's how this movie strikes me.",id,imdb,msp
