,in domain,ood,text,domain,dataset,partition
0,imdb,sst2,"Alistair Simms inspired portrayal of Miss Fritton transcends drag. It is one of the great comedy characters in film. Equally wonderful is Joyce Grenfell's character - Ruby Gates.<br /><br />This is a movie you should curl up on the sofa with on a wet Sunday's afternoon and be transported to a time long ago when terrifying, rampaging school girls only gained our respect - not our ire! I hear that a remake is in the offing with Rupert Everett as Miss Fritton? He will have a hard job competing with the master - or should that be mistress? - Alistair Simms.<br /><br />Go and rent it - it beats so much of what today goes for comedy.",id,imdb,common
1,imdb,sst2,"Looking backwards to that year 2002 when ""Furia"" was made, one can easily recognize the heralding sings of today's New Generation in Romania.<br /><br />The main qualities of ""Furia"" stand in a very solid script, with a substantial dramatic core and a really professional developing, plus a cast of excellent actors. All four leading roles are admirably performed, both with depth and casualness: Dragos Bucur and Andy Vasluianu confirmed, since then, being two of our best performers today, Dorina Chiriac follows them closely, and Adrian Tuli, a non-professional (in real life, a graveyard manager!) cast as Gabonu, was a genuine revelation! <br /><br />Further, Radu Muntean's directing is skilled and expressive, creating in a very compelling style that feeling of ""a fateful night"" and inescapable destiny. One can easily pass over the few awkward and even failed moments, since time proved them to be only the uncertainties inherent to a debut, never repeated in his subsequent movies: ""Hârtia va fi albasträ"" and ""Boogie"".",id,imdb,common
2,imdb,sst2,"I agree with the Aussie's comments for the most part. However, there id seem to be a fairly decent plot, if unoriginal. Christina (Kelli McCarty) inherits a rural property that she intends to open a mountain lodge. She gets reacquainted with Chip (Bobby Johnston) whom she had known when she was growing up in there. The plot thickens when James (Paul Logan) arrives with his new stripper friend, Shene (Devinn Lane) because Christina had been James' stripper friend in years gone by, and the implication is that James had done her wrong somehow. To add interest to the movie Sophia Linn (Monique Parent) a romance novelist shows up as a guest at the lodge, as do Eric (Sebastien Guy) and Linda (Flower), pair of lawyers from the city. James sicks the local building codes inspector on Christina's business as one of his dirty tricks to shut her down. So the question is, ""How far will James go to sabotage the lodge and will he succeed?""<br /><br />Watch for Devinn Lane here and in ""Beauty Betrayed."" She seems to be making a transition from the hard core business to the ""R"" world. Another notable is Samantha McConnell, playing the role of ""Bait,"" clearly the most outrageous character name in the movies!",id,imdb,common
3,imdb,sst2,I love watching steven seagal movies not because of the action of the great plot holes but just because it makes me laugh<br /><br />oh it makes me laugh so hard this movie totally got no point and is ridiculous compared to this movie Pearl harbor rocks!!! and Ben affleck need no acting school at all just to give a impression how bad it is<br /><br />first off all there so many goofs and bad acting its just getting worse like when steven is try to get out of jail a chopper lands at first the security notice and they led them land when they fly away all of the sudden a guard start shooting<br /><br />or when he killed that guy in the car he and treach both walk away you can't see no oil on the ground behind him steven notice that there is oil without even watching treach trows a lighter and the car blows up<br /><br />and there are plenty of more goofs Steven uses his basic action when someone is pointing a gun at him he grabs it and shoot him totally bullshit!!! like some gangster would let that ever happen.<br /><br />the acting is also very worse at the fight scene in the jail outdoor place you can see steven clearly wait to come in action just rewind it a couple of time and you notice the bad acting<br /><br />its just makes me laugh i hope one day it comes to the cinema's here in Holland then i'll go there with as many friends as possible just to laugh my self to death,id,imdb,common
4,imdb,sst2,Well...I like this movie first of all because it's very well thought of... and well..because the um...director and others chose an extremely great actor to play Mike....and also my last reason because ( my opinion) Elijah Wood is so so hot!!!,id,imdb,common
5,imdb,sst2,"One of the worst theatrical movies of the year, if not all time. Anthony Hopkins belittles himself by even appearing in this joke. I can't believe David Mamet and Ridley Scott's name appear on this travesty. The best career move Jody Foster ever made was turning this one down. Julianne Moore was as emotionless throughout as a female Keanu Reeves. Gary Oldman was of course, his brilliant self. He is a crippled victim of Hannibal and the make-up is so good, I didn't know it was Gary until the final credits. but eaten by trained boars??? Give me a break! Rumor has it that he didn't want his name even mentioned in the credits. And frying and feeding his own brain to Ray Liotta...I was laughing at the absurdity, no make that stupidity of this flick at this point. I haven't seen so many people walk out of a movie since Who's That Girl.<br /><br />Pay someone else to go for you if you must, but miss this one AT ALL COST!!!",id,imdb,common
6,imdb,sst2,"EXCUSE ME!!! HellOOOOOOOOOO!!!!!!!!!!! CUBA GOODING,Jr. Should Have Won An Oscar For His Portrayal In This Film!!! He WAS the film! While the film may be lacking in some areas, Cuba was awesome... and for me, this is the best role that he has ever played! The scene in the movie where he finds out that his mother has died made me break down and cry IN THE THEATER!! I guess I could really relate to this film because I saw the same treatment of people just like that at my own school growing up... what a tragedy! Getting to see the ""real"" Radio and coach at the end of the movie was really special too! If you can watch this movie and not be moved to tears, you need a heart check! If you liked ""Simon Birch"" and ""The Mighty"", you'll love ""Radio"" too! I wish they made more movies like this...Radio is the Real Deal!",id,imdb,common
7,imdb,sst2,"Shtrafbat is the story only Russians could tell about the Second World War. The largest front of the whole conflict has been, ironically, the least appearing subject on the silver screen after the war. While the Western Allies war-effort has been pictured in almost every possible detail and manner, the East has been left out or the job has been left to only some old propaganda movies of little else than historical footage value.<br /><br />There is no chance that Shtrafbat could compete with Band of Brothers in every detail but neither you want to look at the screen with examining petty visual effects in mind. That the soldiers are Russians is enough big reason to forgive the less eye-captivating battle scenes and you can concentrate on the story that is the most interesting. So much different was the war in the Eastern front, and the nature of the Russian army, that you might wish people to produce more dramatizations from the other fronts, and of armies.<br /><br />Shtrafbat is no way perfect, but it has some rare specialties that augment the overall rating. It tends to crush myths people have about the Second World War, the true heroes were Russian people and not their leaders who sent them to missions where they could only perish. Another great myth bust is that it presents the enemy, who does not pick up his gun, as an equal human being - an advancement that has been difficult to try in many acclaimed films as well. Shtrafbat shows how the war in the eastern front was a war of survival and how the clash of the -isms grinds people into dust.",id,imdb,common
8,imdb,sst2,"I bought ""Rocketship X-M"" on DVD in a two-pack with ""Destination Moon."" Now I see why the distributors did that: no one who had ever seen this movie would buy it on its own.<br /><br />I cannot fathom what school system turned out the reviewer who claimed that RXM is ""great in its predictions of how space travel would take place..."" Launch straight up, and then do a 90-degree right turn and circle faster and faster until you reach escape velocity... I don't think I recall that from the Apollo program. Never mind that the astronauts should be weightless once they shut off the engines, gravity changes directions every time they pass through the hatch to the engine room. Going to the moon, but ""missed"" it? No problem, it's just a hop-skip-and-a-jump (with a helping hand from divine providence) and you'll be at Mars! And OK, if you want to put life on Mars, given the state of planetary knowledge in 1950, it was a forgivable convention for the sake of the storytelling, but can you make them look at least a LITTLE alien? These Martians looked like extras from the cast of ""10,000 B.C."" I can accept some scientific mistakes, but this wouldn't pass muster with an above-average second-grader.<br /><br />And that's aside from the screaming plot holes: 12 minutes before launch (as you're reminded of constantly by the nagging P.A. voice saying ""X minus so many minutes"") the astronauts are giving a press conference! I guess the time crunch is why Dr. Eckstrom didn't change out of his coat and tie before launching into space. And how handy that, even though they were planning to go to the moon and had pressure suits for that, they brought hiking gear (and rifles!) just in case they ended up at Mars. They're lucky they landed anywhere, since apparently the method they had developed for landing was to have Dr.E look out the window and tell the ""pilot"" (Lloyd Bridges) to tweak down the throttles every now and then. Note to the designers of the XM-2: how about giving the pilot a window seat? <br /><br />Ditto the previous comments on the casual sexism that had eye-candy Dr. Lisa (Osa Massen) doom them all by repeatedly screwing up her fuel calculations, but hey that was the early '50s. She was there to fill her sweater, not a useful function.<br /><br />""Rocketship X-M"" is notable for being one of the first of the first films to say ""ohmigod we're all going to blow ourselves up with these here A-bombs"", but one can note that about it without wasting 77 minutes watching such dreck. By the way, that message might have had a bit more impact had there been some money in the budget for actual sets of the Martian city ruins, rather than just matte paintings.<br /><br />I can appreciate ""good"" bad sci-fi, for the unique way the ""future"" used to look, and for the inherent (if condescending) humor you can find when when we look back on the naivety of audiences 60 years ago, but this film must have been insulting even then. ""Rocketship X-M"" isn't even suitable for an MST3K-style lampooning. Sometimes, bad is just... bad.<br /><br />Anybody want to buy a DVD? Used only once, I swear.",id,imdb,common
9,imdb,sst2,this is the worst movie ive ever seen. And i have seen lots of movies. Me and my friends rented this one a wendsday evening. Man we had lots of fun. This movie is the worst most boring crap ive ever seen. But it makes you laugh! U will lay on the floor rolling around tryin to get some air. You wonder why? Just rent it and check for the keyboard playing girl at that sleazy russian bar. My mother would make a 1000 times better movie about her feedin the cats.,id,imdb,common
10,imdb,sst2,"harrison 's flowers puts its heart in the right place , but its brains are in no particular place at all . ",ood,sst2,common
11,imdb,sst2,"does n't offer much besides glib soullessness , raunchy language and a series of brutal set pieces ... that raise the bar on stylized screen violence . ",ood,sst2,common
12,imdb,sst2,"( director ) o'fallon manages to put some lovely pictures up on the big screen , but his skill at telling a story -- he also contributed to the screenplay -- falls short . ",ood,sst2,common
13,imdb,sst2,"Well, the artyfartyrati of Cannes may have liked this film but not me I am afraid. If you like the type of film where shots linger for so long that you wonder whether the actor has fallen asleep or the cameraman gone for lunch then it may be for you. A large part of it is like this with short sojourns into the realm of unpleasantness. I did not find it shocking nor disturbing as some other reviewers have - simply a little distasteful and pointless. The only reason I did not give this one star is that the acting is commendable ans the film is fairly well shot. The plot, however, has little to recommend. A large part of the film just shows a grumpy woman teaching or listening to piano, which might appeal to some people. But lest you think this is harmless enough be prepared for some snatches of pornography and sexual violence just to wake you up with a bad taste in your mouth. Not recommended.",id,imdb,msp
14,imdb,sst2,"Lucio Fulci made a lot of great films throughout his career and the way that many of them featured a bucket load of gore lead to him earning the title 'The Godfather of Gore'. While Don't Torture a Duckling was made before Fulci became well known amongst gorehounds, and isn't all that gory; it's certainly a gritty and nasty little thriller, and for my money - the best film that Fulci ever made! Don't Torture a Duckling really is head and shoulders above a lot of the Giallo genre in terms of production values and unlike many of Fulci's later films, everything about this Giallo is great. The plot focuses on a small rustic community where dead bodies have began turning up. The murders are even more shocking because the victims are just young boys. Shortly after the police convict an innocent man of the crimes, a reporter named Andrea Martelli arrives in the village and decides to start investigating the murders on his own. Martelli soon encounters various suspects, including a sexy young lady named Patricia, a sinister priest and a local witch who enjoys making wax effigies and sticking pins into them.<br /><br />While this film may not feature loads of gore, it does have two of Fulci's nastiest sequences to make up for it. The nastiest involves a woman being brutally slaughtered by a group of men in a cemetery, while the image of a man falling from a cliff and hitting any number of rocks on the way down is liable to turn some stomachs. Don't Torture a Duckling features an absolutely great Italian cast. Barbara Bouchet (a personal favourite of mine) is incredibly sexy in her role as Patricia, and gets to flex her acting muscles more than she did in many later films. Tomas Millian is excellent as usual while the rest of the cast is well fleshed out by likes of Irene Pappas, Florinda Bolkan and Marc Porel. The cinematography on display is stunning and Fulci really gives the viewer the impression that he puts a lot of care and effort into every scene. The story plays out slowly, and it's always interesting as Fulci never allows the film to stray too much from the central plot line. There isn't a great deal of mystery towards the identity of the murderer; but Fulci almost manages to keep us guessing right up until the end and Don't Torture a Duckling does climax on a high. Overall, it's a shame that Fulci didn't make more films like this. Don't Torture a Duckling is his out and out best work and I insist that every Giallo fans sees it!",id,imdb,msp
15,imdb,sst2,"This movie was everything but boring. It deals with reality. To the people who think this movie was boring, open your eyes to the real problems in our society. Our children are dying. The consequences of alcohol and drug abuse are not to be ignored. I work in a correctional facility as a chemical dependency counselor,and i deal with these problems every day. People of all ages and all walks of life are effected by the consequences of their alcohol and drug abuse. It destroys families, hurts people and leads to serious brain damage,all kinds of health problems, and death. It is all preventable. This movie should be shown in every high-school in the world. If anyone owns this movie and wants to sell it, or sell me a copy, please e-mail me at: Ottenbreit2@netzero.net thank you",id,imdb,msp
16,imdb,sst2,"This movie was ridiculous from the start. Let me save you all time from watching this movie. A woman who sells corn liquor to the locals takes in her cousin or nephew and he convinces her to open a café downstairs from her home. She does and she and the cousin become close. There is a scene later where she is locking lips with him. Later, the woman finds out an old boyfriend is coming back from jail and its tense between them, leading to a down and out fist fight in the café. The woman's cousin/nephew is enamored by the man. The ending was awful, the story was awful, and if I could get back the time wasted on this movie, I would appreciate it. A definite skip.",id,imdb,msp
17,imdb,sst2,"This film is by far the worst film I have ever seen in my life. A woman ""The EX"" pretends to be a number of people in order to gain access to her ex-husband. Killing people for no- reason in baths to achieve her goal. The women I don't think ever went to acting college. She just spends the whole film making stupid expressions, and she looks like she is trying her absolute hardest to avoid looking into the camera. Failing on most occasions. She makes friends with her Ex Husband's wife and son, she does this to use them against her husband. At first when you watch this film, you think that the ""Ex"" wants to kill her ex-husband, maybe because he has treated her in a bad way. But in fact the women is obsessed with the man and wants him back. The two of them used to enjoy rough entertainment (using whips of course). My advice to the general public is do not buy this film, do not rent this film and do not watch it like I did (at 1.15am on FOX)",id,imdb,msp
18,imdb,sst2,"I first watched this in black and white, circa Christmas in the early Sixties, when it was shown on British television. I was absolutely hooked, and watched it over again whenever it was repeated on TV (possibly two or three times only, as it happens - if only we'd had video recorders then!).<br /><br />As outlined by other contributors, the plot describes the return of Hoppity the Grasshopper, after a period spent away, to a Forties American city. He finds that all is not as he left it, and his good insect friends (who live in the 'lowlands' just outside the garden which belongs to a songwriter and his wife) are now under threat from the 'human ones', who are trampling through the broken down fence which prefaces the property, using it as a shortcut.<br /><br />Insect houses are being flattened by their feet, and are also often burned by cast away cigar butts and matches. Old Mr Bumble and his beautiful daughter Honey (Hoppity's childhood sweetheart) are in grave danger of losing their Honey Shop to this threat.<br /><br />To compound their problems, devious insect 'property magnate' C. Bagley Beetle has romantic designs on Honey Bee himself, and hopes, with the help of his henchmen Swat the Fly and Smack the Mosquito, to force Bumble to give him her hand in marriage.<br /><br />Will the heroic and fearless Hoppity win the day, and manage to save the community of bugs from their dastardly fate, and especially his precious Honey from hers? Enjoy the classic songs (""Katy Did, Katy Didn't"" is a superb, swinging, upbeat example), and the colourful visuals, as the tale unfolds.<br /><br />Time has not blunted my fascination for this masterpiece of animation and story-telling, and I was much pleased to find that it had been released to video, although I later found out that it was in NTSC PAL format. Never mind, I sent off for the video immediately, and only then bought a portable TV/video combination (complete with NTSC playback).<br /><br />I have enjoyed many nostalgic viewings since then, and have even discovered that the TV rights have switched from BBC (who informed me they were unlikely to ever show the film on any of their stations) to FilmFour, who have (at last!) been showing it on their digital stations in early 2007.<br /><br />My granddaughter (aged three) was absolutely entranced while we watched it together - and this is a child who has been influenced by the digital age and the resulting computer-generated productions!<br /><br />I would thoroughly recommend this film for any age, and especially the youngest of viewers.<br /><br />Give Max Fleischer a posthumous Oscar!",id,imdb,msp
19,imdb,sst2,"Hayao Miyazaki has captured the imagination of audiences young and old across the globe, and his most recent cinematic work of art is ""Ponyo,"" a children's fairytale borrowing on story elements from The Little Mermaid. Of course like other Miyazaki classics such as ""Spirited Away"" and his last film, ""Howl's Moving Castle,"" ""Ponyo"" is full of a creativity that can only be truly appreciated by adults, but this it is distinctly more a children's story than those recent efforts. It's a magical story best described as beautiful and lovable, aiming for charm instead of conflict.<br /><br />""Ponyo"" is the story of a bug-eyed childish-looking fish of the same name, the daughter of an undersea sorcerer, who longs to escape the sea and become a little girl. When she does, she quickly befriends a young boy named Sosuke. In the process she gains a strong magic and unknowingly throws the world out of balance between land and sea, and a giant storm drowns most of the cliff-top town where Sosuke lives with his mother, and it threatens to end the world.<br /><br />Like ""Howl's Moving Castle,"" Walt Disney picked up ""Ponyo"" for an American release and dubbed it over with an impressive selection of Western voices, even choosing homegrown products in the youngest siblings of Disney band the Jonas Brothers (Frankie Jonas) and Miley Cyrus (younger sister Noah) to voice Sosuke and Ponyo, respectively. Also voicing characters are Liam Neeson (Fujimoto, Ponyo's father), Tina Fey (Lisa, Sosuke's mother), Matt Damon (Sosuke's father), Cate Blanchett (Ponyo's sea goddess mother) and a trio of hilarious elderly women are played by Betty White, Cloris Leachman and Lily Tomlin. The effort is definitely there to make this film appeal to American audiences and Disney is getting close.<br /><br />But voices are of little significance in a Miyazaki film, which is all about visual creativity. A fan of transformations and animating liquid and fluid motion, creating a fairytale taking place partly underwater must've been a joy for Miyazaki to work with and maybe even his entire motivation for choosing this story. Among the highlights are droplets of water that Fujimoto sends after Ponyo that move like living waves, as well as a variety of other magnificent sea creatures and breathtaking storm scenes make ""Ponyo"" as awing as any other Miyazaki film.<br /><br />As a children's story, however, ""Ponyo"" concentrates its efforts on being adorable. The discovery of true friendship and love between Sosuke and Ponyo is heart-warming, even if Noah Cyrus shouting childishly when Ponyo excitedly embraces human life can get a bit annoying. But as delightful as many of the imaginative elements and loving relationships are, there's very little antagonism or danger. Past Miyazaki films have clear villains, but the conflict in ""Ponyo"" actually shrinks as the story goes along. Sosuke believes he's lost his mother at one point and in the background is the idea of the world going out of whack and that humans should be ashamed of polluting the sea, but ""Ponyo"" is mostly tension free. Most glaringly, its climax is uneventful despite how overall likable all the characters are.<br /><br />""Ponyo"" will surely satisfy Miyazaki's fans in every way with its imagination, and newcomers will still be smitten by his simple yet visually ambitious storytelling, but this is distinctly more of a children's movie, best for families and others who love fantasy regardless of its form or target audience. It's not quite what you'd expect from Miyazaki considering his recent work, but it's sure to be remembered as another of his beloved stories. ~Steven C<br /><br />Visit my site at http://moviemusereviews.blogspot.com",id,imdb,msp
